,,Actual Website,,,,,,,,,,,,,,,,,,,,,,,,,,,,,,,,,,,,,,,,,,,,,,,,,,,,,,,,,,,,,,,,,,,,,,,,,,,,,,,,,,,,,,,,,,,,,,,,,,,,,,,
https://clutch.co/profile/devsx,https://r.clutch.co/redirect?analyticsjs=true&category=Marketing+Automation&content_group=directory&debug_mode=false&event_category=visit_website&event_label=1213628&from_page=https%3A%2F%2Fclutch.co%2Fit-services%2Fmarketing-automation&is_sponsor=false&keyword=Marketing+Automation&no_click=1&page_canonical_id=1230000000000&page_location=https%3A%2F%2Fclutch.co%2Fit-services%2Fmarketing-automation&page_number=0&page_type=directory&pid=1213628&position=20&source=directory&trace_id=94a59e4b7941ea32&transport_url=https%3A%2F%2Fg.clutch.co&u=https%3A%2F%2Fdevsx.net%2F%3Futm_source%3Dclutch.co%26utm_medium%3Dreferral%26utm_campaign%3Ddirectory,http://www.mypurplesales.com,DevsX,"DevsX is a versatile software development company specializing in mobile app and web development, with a strong focus on SaaS solutions and custom software projects. Across multiple reviews, 100% of clients commend their project management, responsiveness, and adherence to timelines. Notably, 70% of the reviews highlight their excellent communication and alignment with client needs, while around 30% mention their proficiency in delivering high-quality, launch-ready products. Overall, DevsX is praised for their professionalism and value for cost.",4.9,,"11
                        
                            reviews","$10,000+",$25 - $49 / hr,50 - 249,"Luts'k, Ukraine",15% CRM Consulting and SI,20% Custom Software Development,20% Mobile App Development,3,20% Web Development,15% ERP Consulting and SI,10% AR/VR Development,,,20% Marketing automation,20% CRM Customer Support,20% CRM Social Relationship Management,2,20% Other CRM focus,See all 11 projects,Open to feedback,,,,,,,,,,,,,,,,,,,,,,,,,,,,,,,,,,,Reviewed 3 times in the past 6 months,3 of 3 reviews are 5 stars,"$10,000 – $49,000 avg. project cost","In the last six months, DevsX has received positive feedback for their project management and responsiveness. Clients praised their ability to deliver high-quality solutions on time and within budget. For instance, a co-founder noted a significant increase in sales and customer engagement after a website overhaul, while another client highlighted the team's capability to swiftly adapt to changing requirements. Overall, the sentiment is highly favorable, with no major areas for improvement identified by clients.",Read 3 Recent Reviews,https://clutch.co/profile/devsx?sort_by=date_desc#reviews,Was this helpful?,3 fixed price CRM Consulting and SI packages,,,,,,,,,,,Was this helpful?,,,,,,,,,,,,,,,,,,Very responsive,More responsive than most other service providers,DevsX is very responsive,They are a great candidate to start a conversation with. Send them a short message or project inquiry.,Get in Touch,https://clutch.co/profile/devsx#contact,Was this helpful?,20% Sales automation
https://clutch.co/profile/purple-sales,https://r.clutch.co/redirect?analyticsjs=true&category=Marketing+Automation&content_group=directory&debug_mode=false&event_category=visit_website&event_label=1473699&from_page=https%3A%2F%2Fclutch.co%2Fit-services%2Fmarketing-automation&is_sponsor=false&keyword=Marketing+Automation&no_click=1&page_canonical_id=1230000000000&page_location=https%3A%2F%2Fclutch.co%2Fit-services%2Fmarketing-automation&page_number=0&page_type=directory&pid=1473699&position=21&source=directory&trace_id=94a59e4b7941ea32&transport_url=https%3A%2F%2Fg.clutch.co&u=http%3A%2F%2Fwww.mypurplesales.com%2F%3Futm_source%3Dclutch.co%26utm_medium%3Dreferral%26utm_campaign%3Ddirectory,https://monkeywizard.io,Purple Sales,"Purple Sales is a CRM Consultancy specializing in CRM Integration and CRM Implementation services. The feedback is overwhelmingly positive, with 100% of reviewers highlighting their attentive project management and strategic alignment with client goals. Clients appreciate their deep understanding and commitment to client success, with no significant areas for improvement noted.",4.7,5,"17
                        
                            reviews","$5,000+",$50 - $99 / hr,10 - 49,"Toronto, Canada",10% CRM Consulting and SI,65% Sales Outsourcing,10% Call Center Services,3,5% Content Marketing,5% Email Marketing,5% Web Design,,,45% Marketing automation,45% Sales automation,10% CRM Social Relationship Management,,,See all 17 projects,Well-organized projects,Reviews mention Well-organized projects,"Clients consistently praise Purple Sales for their well-organized project management and effective communication. One client highlighted their ability to maintain open lines of communication, ensuring timely delivery and alignment with expectations. Another noted the tailored workflow developed for their specific needs, emphasizing the clarity and attentiveness of Purple Sales' team. Overall, the sentiment reflects a strong appreciation for their structured approach and commitment to client satisfaction.",Software Implementation for Nonprofit Mortgage Association,"Feb 29, 2024","They were good at keeping up with project deliverables and maintaining open communication throughout the duration of the project to ensure work was being done on time, as expected. We had regular virtual meetings to review completed items and any outstanding work. They constantly asked us for feedback on how things were going to ensure they were in line with expectations.",Read Full Review,https://clutch.co/go-to-review/purple-sales/272463,Lead Gen & Digital Marketing for Growth Strategy Firm,5,"Jan 3, 2023",Purple Sales developed a workflow with us that was tailored to how we work and out own sales process. We have weekly touch-base meetings with their team to go over progress and next steps for each buyer persona. .,Read Full Review,https://clutch.co/go-to-review/purple-sales/174344,"They are very well organized, attentive, and their communications are clear",Read All Reviews,https://clutch.co/profile/purple-sales#reviews,Was this helpful?,4.7 out of 5.0 rating for cost,Average Project Cost Breakdown,https://clutch.co/profile/purple-sales?project_cost=10000#reviews,"$10,000 to $49,000 (8)",https://clutch.co/profile/purple-sales?project_cost=50000#reviews,"$50,000 to $199,999 (4)",https://clutch.co/profile/purple-sales?project_cost=less_10000#reviews,"Less than $10,000 (3)",https://clutch.co/profile/purple-sales?project_cost=1000000#reviews,"$200,000 to $999,999 (1)",https://clutch.co/profile/purple-sales?project_cost=10000000#reviews,"$1,000,000 to $9,999,999 (0)",What Clients Have Said,"Clients have consistently praised Purple Sales for delivering strong value relative to their costs, often citing 'good value for cost' and 'pricing fit our budget' as key reasons for their selection. One client noted a 32% improvement in conversion rates and a significant reduction in customer acquisition costs, highlighting the effectiveness of Purple Sales' strategies. Overall, the sentiment is overwhelmingly positive, with clients expressing satisfaction with the return on investment and the quality of service provided.",Read All Reviews,https://clutch.co/profile/purple-sales#reviews,Was this helpful?,,,,,,,,Completed projects in 3 countries,Canada (11),https://clutch.co/profile/purple-sales#reviews,France (1),United States (4),https://clutch.co/profile/purple-sales#reviews,,,,,,Was this helpful?,,1 review mentions CRM Consulting and SI,1 of 1 CRM Consulting and SI reviews are 5 stars,"$10,000 – $49,000 avg. project cost",,CRM Consulting and SI PROJECT HIGHLIGHT,Branding for Cybersecurity Professional Services Firm,"—  Purple Sales provides branding services for a cybersecurity professional services firm. The team is tasked with tech stack implementation, consulting, lead generation, and outreach strategies.",5,Read more,https://clutch.co/go-to-review/purple-sales/285243,Read 1 Review,https://clutch.co/profile/purple-sales?service_provided=CRM%20Consulting%20and%20SI#reviews,Was this helpful?,,https://clutch.co/profile/purple-sales?project_cost=more_10000000#reviews,"$10,000,000 + (0)",,,,,,,,
https://clutch.co/profile/monkey-wizard-media,https://r.clutch.co/redirect?analyticsjs=true&category=Marketing+Automation&content_group=directory&debug_mode=false&event_category=visit_website&event_label=2373375&from_page=https%3A%2F%2Fclutch.co%2Fit-services%2Fmarketing-automation&is_sponsor=false&keyword=Marketing+Automation&no_click=1&page_canonical_id=1230000000000&page_location=https%3A%2F%2Fclutch.co%2Fit-services%2Fmarketing-automation&page_number=0&page_type=directory&pid=2373375&position=22&source=directory&trace_id=94a59e4b7941ea32&transport_url=https%3A%2F%2Fg.clutch.co&u=https%3A%2F%2Fmonkeywizard.io%2F%3Futm_source%3Dclutch.co%26utm_medium%3Dreferral%26utm_campaign%3Ddirectory,https://www.axeautomation.co,Monkey Wizard Media,"Monkey Wizard Media is a company specializing in CRM Consulting and CRM Implementation, noted for their expertise in digital marketing, web development, and SEO. With 100% positive feedback, clients praise their rapid delivery and effective project management, with an increase in customer acquisition as a key outcome of their services.",4.9,,"9
                        
                            reviews","$1,000+",$50 - $99 / hr,2 - 9,"Hvalstad, Norway",10% CRM Consulting and SI,40% Conversion Optimization,10% E-Commerce Development,4,10% Email Marketing,10% UX/UI Design,10% Web Design,10% Web Development,,50% Marketing automation,40% Sales automation,10% Other CRM focus,,,See all 9 projects,,,,,,,,,,,,,,,,,,,5.0 out of 5.0 rating for cost,Average Project Cost Breakdown,https://clutch.co/profile/monkey-wizard-media?project_cost=10000#reviews,"$10,000 to $49,000 (2)",https://clutch.co/profile/monkey-wizard-media?project_cost=less_10000#reviews,"Less than $10,000 (1)",https://clutch.co/profile/monkey-wizard-media?project_cost=50000#reviews,"$50,000 to $199,999 (1)",,,,,What Clients Have Said,"Clients consistently praise Monkey Wizard Media for their excellent value for money, highlighting their competitive pricing and high-quality deliverables. One client noted they chose the company for 'good value for cost,' while another emphasized that their ROI improved significantly after engaging their services. Overall sentiment is highly positive, with clients appreciating the efficient project management and responsiveness, often stating that the outcomes exceeded their expectations.",Read All Reviews,https://clutch.co/profile/monkey-wizard-media#reviews,Was this helpful?,Reviewed 2 times in the past 6 months,2 of 2 reviews are 5 stars,1 new review for CRM Consulting and SI services,"Recent reviews for Monkey Wizard Media indicate a strong overall sentiment, highlighting their efficiency and effectiveness in enhancing client visibility and lead generation. A carpentry company noted a significant increase in customer numbers and praised the team's rapid execution and excellent project management. Similarly, a home care service emphasized their proactive communication and high-quality deliverables, stating the website was developed swiftly and met all requirements. Both clients expressed high satisfaction and trust in the agency's capabilities.",Read 2 Recent Reviews,https://clutch.co/profile/monkey-wizard-media?sort_by=date_desc#reviews,Was this helpful?,,,,,,,,,,,,,,1 review mentions CRM Consulting and SI,1 of 1 CRM Consulting and SI reviews are 5 stars,1 new review for CRM Consulting and SI in past 6 months,"$10,000 – $49,000 avg. project cost",CRM Consulting and SI PROJECT HIGHLIGHT,"Web Design, Dev, SEO & SMM for Carpentry Company","—  Monkey Wizard Media has designed and developed a website from scratch for a carpentry company. The team also provides SEO services and manages the client's ads on Facebook, Instagram, and Snapchat.",5,Read more,https://clutch.co/go-to-review/monkey-wizard-media/361081,Read 1 Review,https://clutch.co/profile/monkey-wizard-media?service_provided=CRM%20Consulting%20and%20SI#reviews,Was this helpful?,"$10,000 – $49,000 avg. project cost",,,Very responsive,More responsive than most other service providers,Monkey Wizard Media is very responsive,They are a great candidate to start a conversation with. Send them a short message or project inquiry.,Get in Touch,https://clutch.co/profile/monkey-wizard-media#contact,Was this helpful?,
https://clutch.co/profile/axe-automation,https://r.clutch.co/redirect?analyticsjs=true&category=Marketing+Automation&content_group=directory&debug_mode=false&event_category=visit_website&event_label=2275301&from_page=https%3A%2F%2Fclutch.co%2Fit-services%2Fmarketing-automation&is_sponsor=false&keyword=Marketing+Automation&no_click=1&page_canonical_id=1230000000000&page_location=https%3A%2F%2Fclutch.co%2Fit-services%2Fmarketing-automation&page_number=0&page_type=directory&pid=2275301&position=23&source=directory&trace_id=94a59e4b7941ea32&transport_url=https%3A%2F%2Fg.clutch.co&u=https%3A%2F%2Fwww.axeautomation.co%2F%3Futm_source%3Dclutch.co%26utm_medium%3Dreferral%26utm_campaign%3Ddirectory,https://www.boundify.io,Axe Automation,"Axe Automation is a CRM Consulting and Systems Integration company specializing in automation solutions. They receive overwhelmingly positive feedback, with 100% of reviewers praising their knowledge of automation tools and effective project management. Their services include optimizing processes and automating tasks, consistently delivering projects on time and meeting client needs.",5,,"12
                        
                            reviews","$1,000+",Undisclosed,10 - 49,"Marina del Rey, CA",15% CRM Consulting and SI,25% AI Development,25% ERP Consulting and SI,2,25% Robotics Process Automation,10% Low/No Code Development,,,,35% Marketing automation,35% CRM Customer Support,30% Sales automation,,,See all 12 projects,Personable,,,,,,,,,,,,,,,,,,4.9 out of 5.0 rating for cost,Average Project Cost Breakdown,https://clutch.co/profile/axe-automation?project_cost=less_10000#reviews,"Less than $10,000 (4)",https://clutch.co/profile/axe-automation?project_cost=10000#reviews,"$10,000 to $49,000 (1)",,,,,,,What Clients Have Said,"Clients consistently praise Axe Automation for its excellent value for money, noting that the pricing aligns well with their budget while delivering high-quality automation solutions. For instance, one client highlighted significant cost savings, reducing reliance on virtual assistants, while another appreciated the impressive ROI from increased efficiency. Overall, the sentiment reflects satisfaction with the cost-effectiveness and the exceptional service provided, often exceeding client expectations.",Read All Reviews,https://clutch.co/profile/axe-automation#reviews,Was this helpful?,,,,,,,,Completed projects in 3 countries,Canada (1),https://clutch.co/profile/axe-automation#reviews,Chile (1),United States (7),https://clutch.co/profile/axe-automation#reviews,,,,,,Was this helpful?,,,,,,,,,,,,,,,,,,Very responsive,More responsive than most other service providers,Axe Automation is very responsive,They are a great candidate to start a conversation with. Send them a short message or project inquiry.,Get in Touch,https://clutch.co/profile/axe-automation#contact,Was this helpful?,
https://clutch.co/profile/boundify,https://r.clutch.co/redirect?analyticsjs=true&category=Marketing+Automation&content_group=directory&debug_mode=false&event_category=visit_website&event_label=66156&from_page=https%3A%2F%2Fclutch.co%2Fit-services%2Fmarketing-automation&is_sponsor=false&keyword=Marketing+Automation&no_click=1&page_canonical_id=1230000000000&page_location=https%3A%2F%2Fclutch.co%2Fit-services%2Fmarketing-automation&page_number=0&page_type=directory&pid=66156&position=24&source=directory&trace_id=94a59e4b7941ea32&transport_url=https%3A%2F%2Fg.clutch.co&u=https%3A%2F%2Fwww.boundify.io,https://scriptics.ro,Boundify,"Boundify is a digital marketing agency specializing in services such as SEO, Google Ads, CRM integration, and lead generation. Their reviews reflect a positive client experience, highlighting their commitment to project management, communication, and delivering results-driven strategies. About 100% of reviewers commend their effective communication and timely delivery, while 75% emphasize their ability to align with company values.",5,,"4
                        
                            reviews","$1,000+",$100 - $149 / hr,2 - 9,"Greenville, SC",15% CRM Consulting and SI,20% Demand Generation Marketing,15% Pay Per Click,5,10% Conversion Optimization,10% Digital Strategy,10% Search Engine Optimization,10% Social Media Marketing,10% Web Design,30% Marketing automation,30% Sales automation,20% Other CRM focus,2,10% CRM Customer Support,See all 4 projects,Great project management,,,,,,,,,,,,,,,,,,5.0 out of 5.0 rating for cost,Average Project Cost Breakdown,https://clutch.co/profile/boundify?project_cost=less_10000#reviews,"Less than $10,000 (2)",https://clutch.co/profile/boundify?project_cost=10000#reviews,"$10,000 to $49,000 (1)",https://clutch.co/profile/boundify?project_cost=50000#reviews,"$50,000 to $199,999 (1)",https://clutch.co/profile/boundify?project_cost=1000000#reviews,"$200,000 to $999,999 (0)",https://clutch.co/profile/boundify?project_cost=10000000#reviews,"$1,000,000 to $9,999,999 (0)",What Clients Have Said,"Clients consistently commend Boundify for delivering excellent value for money, with feedback highlighting their strong project management and timely delivery. One client noted their 'good value for cost' and another appreciated the 'excellent project management' that kept projects on track. Additionally, clients expressed satisfaction with the measurable outcomes achieved, enhancing lead generation and marketing effectiveness. Overall, the sentiment reflects a positive perception of Boundify’s pricing relative to the quality of services provided.",Read All Reviews,https://clutch.co/profile/boundify#reviews,Was this helpful?,Reviewed 4 times in the past 6 months,4 of 4 reviews are 5 stars,"$10,000 – $49,000 avg. project cost","In the last six months, client feedback for Boundify has been overwhelmingly positive. Clients praised their excellent project management, timely delivery, and responsiveness. Notable mentions include the marketing strategies that significantly increased lead generation and engagement, as highlighted by Interlogix's successful PPC campaigns. Additionally, Designli noted Boundify's unique ability to integrate technical and strategic marketing elements seamlessly. Overall, clients emphasized Boundify's commitment to understanding their needs and delivering tailored solutions.",Read 4 Recent Reviews,https://clutch.co/profile/boundify?sort_by=date_desc#reviews,Was this helpful?,,,,,,,,,,,,,,,,,,,,,,,,,,,,https://clutch.co/profile/boundify?project_cost=more_10000000#reviews,"$10,000,000 + (0)",Very responsive,More responsive than most other service providers,Boundify is very responsive,They are a great candidate to start a conversation with. Send them a short message or project inquiry.,Get in Touch,https://clutch.co/profile/boundify#contact,Was this helpful?,10% CRM Social Relationship Management
https://clutch.co/profile/scriptics,https://r.clutch.co/redirect?analyticsjs=true&category=Marketing+Automation&content_group=directory&debug_mode=false&event_category=visit_website&event_label=283502&from_page=https%3A%2F%2Fclutch.co%2Fit-services%2Fmarketing-automation&is_sponsor=false&keyword=Marketing+Automation&no_click=1&page_canonical_id=1230000000000&page_location=https%3A%2F%2Fclutch.co%2Fit-services%2Fmarketing-automation&page_number=0&page_type=directory&pid=283502&position=25&source=directory&trace_id=94a59e4b7941ea32&transport_url=https%3A%2F%2Fg.clutch.co&u=https%3A%2F%2Fscriptics.ro,https://inventive.io/landing-pages/solving-business-problems-with-tech,Scriptics®️,"Scriptics®️ is a versatile software development company offering custom solutions in web development, ERP systems, and business intelligence tools. The company consistently receives praise for its technical expertise, collaboration, and responsiveness. Over 90% of reviews highlight Scriptics' ability to understand client needs and deliver effective, innovative solutions. Clients appreciate the company's project management skills and the strong alignment with their values, with no significant areas of improvement noted.",5,5,"13
                        
                            reviews","$10,000+",$50 - $99 / hr,10 - 49,"Sibiu, Romania",10% CRM Consulting and SI,40% Web Development,10% Business Consulting,4,10% Custom Software Development,10% ERP Consulting and SI,10% IT Strategy Consulting,10% Low/No Code Development,,25% Marketing automation,25% CRM Customer Support,25% CRM Social Relationship Management,1,25% Sales automation,See all 13 projects,Accessible,Reviews mention Accessible,"Overall sentiment regarding the accessibility of Scriptics®️ is highly positive. Clients praised their availability and responsiveness, noting that urgent matters are addressed immediately. One client highlighted that Scriptics is 'available at all hours' and acts as a true partner, while another emphasized their 'outstanding' availability. The consistent feedback indicates that Scriptics prioritizes customer satisfaction and maintains effective communication throughout the project lifecycle.",BI & Sales Process Development for Boutique Consulting Firm,"Sep 13, 2024",Scriptics is overall a very reliant supplier. . They're a versatile team capable of front- and backend development.,Read Full Review,https://clutch.co/go-to-review/scriptics/314127,Multiple Corporate WordPress Sites for IT Firm,5,"Nov 19, 2019",They have a dedicated project manager on their side who is incredibly responsive and works closely with our designers to determine resources and assets needed for each project. Their support is impressive as . They go above and beyond to meet our deadlines and goals and act as true partners in the success of our site.,Read Full Review,https://clutch.co/go-to-review/scriptics/88579,"Availability is, to this date, outstanding",Read All Reviews,https://clutch.co/profile/scriptics#reviews,Was this helpful?,5.0 out of 5.0 rating for cost,Average Project Cost Breakdown,https://clutch.co/profile/scriptics?project_cost=10000#reviews,"$10,000 to $49,000 (4)",https://clutch.co/profile/scriptics?project_cost=50000#reviews,"$50,000 to $199,999 (3)",https://clutch.co/profile/scriptics?project_cost=less_10000#reviews,"Less than $10,000 (2)",https://clutch.co/profile/scriptics?project_cost=1000000#reviews,"$200,000 to $999,999 (2)",https://clutch.co/profile/scriptics?project_cost=10000000#reviews,"$1,000,000 to $9,999,999 (1)",What Clients Have Said,"Clients consistently commend Scriptics®️ for their excellent value for money and competitive pricing. One client noted, 'Good value for cost,' while another emphasized their 'great culture fit' and alignment with company values. The responsiveness and commitment to meeting project needs further enhance their perceived worth. Overall sentiment suggests that clients feel they receive high-quality services that justify the investment, with one stating they experienced 'less downtime' and 'great customer satisfaction' throughout their collaboration.",Read All Reviews,https://clutch.co/profile/scriptics#reviews,Was this helpful?,,,,,,,,Completed projects in 6 countries,Austria (3),https://clutch.co/profile/scriptics#reviews,Finland (1),Germany (2),https://clutch.co/profile/scriptics#reviews,Italy (1),https://clutch.co/profile/scriptics#reviews,United States (5),https://clutch.co/profile/scriptics#reviews,England (1),Was this helpful?,they are available at all hours to help with tasks and questions both large and small,,,,,,,,,,,,,,,https://clutch.co/profile/scriptics?project_cost=more_10000000#reviews,"$10,000,000 + (0)",,,,,,,,
