,,Actual Website,,,,,,,,,,,,,,,,,,,,,,,,,,,,,,,,,,,,,,,,,,,,,,,,,,,,,,,,,,,,,,,,,,,,,,,,,,,,,,,,,,,,,,,,,,,,,,,,,,,,,,,
https://clutch.co/profile/strong-crm,https://r.clutch.co/redirect?analyticsjs=true&category=Marketing+Automation&content_group=directory&debug_mode=false&event_category=visit_website&event_label=1973196&from_page=https%3A%2F%2Fclutch.co%2Fit-services%2Fmarketing-automation&is_sponsor=false&keyword=Marketing+Automation&no_click=1&page_canonical_id=1230000000000&page_location=https%3A%2F%2Fclutch.co%2Fit-services%2Fmarketing-automation&page_number=0&page_type=directory&pid=1973196&position=36&source=directory&trace_id=94a59e4b7941ea32&transport_url=https%3A%2F%2Fg.clutch.co&u=https%3A%2F%2Fstrongcrm.com%3Futm_source%3Dclutch.co%26utm_medium%3Dreferral%26utm_campaign%3Dit-services-marketing-automation,https://www.coderfy.com,Strong CRM,"Strong CRM is a CRM Consultancy specializing in CRM Implementation and CRM Systems Integration. Reviewers consistently commend their responsiveness, expertise, and value for cost. The company has a solid reputation with 100% positive feedback, highlighting their ability to manage projects efficiently and exceed expectations, including delivering on time and providing strategic insights.",5,5,"4
                        
                            reviews","$10,000+",$150 - $199 / hr,10 - 49,"Seattle, WA",70% CRM Consulting and SI,20% IT Managed Services,10% Application Management & Support,,,,,,,25% Marketing automation,60% Sales automation,15% CRM Customer Support,,,See all 4 projects,Great project management,Reviews mention Great project management,"Strong CRM received high praise for their exceptional project management, with clients noting their responsiveness and ability to deliver ahead of schedule. One client highlighted that Strong CRM not only fulfilled their commitments but also exceeded expectations by providing extensive training and strategic insights. Overall, the sentiment reflects a strong appreciation for their organized approach and dedication to client success.",Salesforce Migration & Dashboards Dev for Cybersecurity Firm,"Apr 26, 2023","They were . For a small company, Strong CRM was incredibly responsive. They also delivered on what they said they would - often going above and beyond -holding trainings for the sales and marketing teams and teaching us all how to take advantage of various automations that made life much easier.",Read Full Review,https://clutch.co/go-to-review/strong-crm/197607,,,,,,,"very responsive, and the project was delivered ahead of schedule",Read All Reviews,https://clutch.co/profile/strong-crm#reviews,Was this helpful?,5.0 out of 5.0 rating for cost,Average Project Cost Breakdown,https://clutch.co/profile/strong-crm?project_cost=10000#reviews,"$10,000 to $49,000 (2)",https://clutch.co/profile/strong-crm?project_cost=less_10000#reviews,"Less than $10,000 (0)",https://clutch.co/profile/strong-crm?project_cost=50000#reviews,"$50,000 to $199,999 (0)",https://clutch.co/profile/strong-crm?project_cost=1000000#reviews,"$200,000 to $999,999 (0)",https://clutch.co/profile/strong-crm?project_cost=10000000#reviews,"$1,000,000 to $9,999,999 (0)",What Clients Have Said,"Clients consistently highlight Strong CRM's competitive pricing and overall value for money. For instance, one client noted that Strong CRM was selected due to its 'good value for cost,' while another emphasized their 'incredible support' and the ability to deliver projects ahead of schedule. Overall, the sentiment reflects satisfaction with the affordability and the high-quality service provided, making them a valued partner in CRM projects.",Read All Reviews,https://clutch.co/profile/strong-crm#reviews,Was this helpful?,,,,,,,,3 fixed price CRM Consulting and SI packages,,,,,,,,,,,Was this helpful?,,2 reviews mention CRM Consulting and SI,2 of 2 CRM Consulting and SI reviews are 5 stars,"$10,000 – $49,000 avg. project cost",,CRM Consulting and SI PROJECT HIGHLIGHT,CRM & Marketing Consulting for IT Company,"—  Strong CRM provides CRM and marketing consulting for an IT company. Strong CRM assists with reporting on revenue sources, building custom Salesforce apps, and overhauling the client's lead",5,Read more,https://clutch.co/go-to-review/strong-crm/205422,Read 2 Reviews,https://clutch.co/profile/strong-crm?service_provided=CRM%20Consulting%20and%20SI#reviews,Was this helpful?,,https://clutch.co/profile/strong-crm?project_cost=more_10000000#reviews,"$10,000,000 + (0)",,,,,,,,
https://clutch.co/profile/coderfy,https://r.clutch.co/redirect?analyticsjs=true&category=Marketing+Automation&content_group=directory&debug_mode=false&event_category=visit_website&event_label=2020965&from_page=https%3A%2F%2Fclutch.co%2Fit-services%2Fmarketing-automation&is_sponsor=false&keyword=Marketing+Automation&no_click=1&page_canonical_id=1230000000000&page_location=https%3A%2F%2Fclutch.co%2Fit-services%2Fmarketing-automation&page_number=0&page_type=directory&pid=2020965&position=37&source=directory&trace_id=94a59e4b7941ea32&transport_url=https%3A%2F%2Fg.clutch.co&u=https%3A%2F%2Fwww.coderfy.com%2F%3Futm_source%3Dclutch.co%26utm_medium%3Dreferral%26utm_campaign%3Dit-services-marketing-automation,https://modelit.xyz,Coderfy,"Coderfy is a versatile digital solutions provider specializing in web development, logo and brand identity design, and software development. Clients consistently praise Coderfy for their professionalism, timely delivery, and adaptability, with 100% positive feedback highlighting their creativity and responsiveness. Their effective project management and alignment with client needs make them a highly recommended choice for various digital projects.",4.9,5,"6
                        
                            reviews","$10,000+",$25 - $49 / hr,10 - 49,"Boca Raton, FL",10% CRM Consulting and SI,25% Web Development,20% Custom Software Development,4,15% Mobile App Development,10% AI Development,10% IT Strategy Consulting,10% Low/No Code Development,,20% Marketing automation,30% CRM Customer Support,20% CRM Social Relationship Management,2,20% Sales automation,See all 6 projects,Accommodating,Reviews mention Accommodating,"The feedback regarding Coderfy highlights their accommodating nature, particularly noted for their ability to adapt to client needs and seamlessly handle mid-project adjustments. One client emphasized their clear communication and responsiveness, even on weekends, which contributed to a collaborative experience. Overall sentiment reflects high satisfaction with Coderfy's services, noting their commitment to meeting deadlines and delivering quality work, thus reinforcing their reputation as a client-focused company.","Branding, Web Design & Development for Financial Services Co","Dec 10, 2024","Coderfy maintained clear and timely communication throughout the project. They adhered to the agreed timelines and . Coderfy's ability to adapt to our specific needs stood out, contributing to a collaborative and successful experience.",Read Full Review,https://clutch.co/go-to-review/coderfy/336605,,,,,,,accommodated several mid-project adjustments seamlessly,Read All Reviews,https://clutch.co/profile/coderfy#reviews,Was this helpful?,5.0 out of 5.0 rating for cost,Average Project Cost Breakdown,https://clutch.co/profile/coderfy?project_cost=less_10000#reviews,"Less than $10,000 (2)",,,,,,,,,What Clients Have Said,"Clients consistently highlight Coderfy's competitive pricing and exceptional value for money. One client noted that the pricing fit their budget while delivering high-quality results, stating they experienced 'good value for cost.' Another emphasized that Coderfy's services exceeded expectations, describing them as 'underpromised and overdelivered.' Overall, the sentiment reflects satisfaction with the company's affordability, responsiveness, and ability to deliver quality work within budget constraints.",Read All Reviews,https://clutch.co/profile/coderfy#reviews,Was this helpful?,,,,,,,,Completed projects in 2 countries,Sweden (1),https://clutch.co/profile/coderfy#reviews,Ukraine (2),,,,,,,,Was this helpful?,,,,,,,,,,,,,,,,,,Very responsive,More responsive than most other service providers,Coderfy is very responsive,They are a great candidate to start a conversation with. Send them a short message or project inquiry.,Get in Touch,https://clutch.co/profile/coderfy#contact,Was this helpful?,10% Other CRM focus
https://clutch.co/profile/modelit,https://r.clutch.co/redirect?analyticsjs=true&category=Marketing+Automation&content_group=directory&debug_mode=false&event_category=visit_website&event_label=978683&from_page=https%3A%2F%2Fclutch.co%2Fit-services%2Fmarketing-automation&is_sponsor=false&keyword=Marketing+Automation&no_click=1&page_canonical_id=1230000000000&page_location=https%3A%2F%2Fclutch.co%2Fit-services%2Fmarketing-automation&page_number=0&page_type=directory&pid=978683&position=38&source=directory&trace_id=94a59e4b7941ea32&transport_url=https%3A%2F%2Fg.clutch.co&u=https%3A%2F%2Fmodelit.xyz%2F%3Futm_source%3Dclutch.co%26utm_medium%3Dreferral%26utm_campaign%3Dit-services-marketing-automation,https://uds.systems,Modelit,"Modelit is a CRM Consulting and Systems Integration company specializing in CRM implementation and integration services. Clients commend their organization, adaptability, and deep understanding of business needs, with 100% of reviews highlighting their proactive problem-solving and culture fit. However, some feedback suggests room for improvement in project management communication for larger projects.",4.9,,"7
                        
                            reviews","$5,000+",$50 - $99 / hr,10 - 49,"Montevideo, Uruguay",30% CRM Consulting and SI,20% IT Managed Services,20% IT Staff Augmentation,3,10% Custom Software Development,10% Low/No Code Development,10% Web Design,,,20% Marketing automation,40% Sales automation,20% CRM Customer Support,1,20% Other CRM focus,See all 7 projects,Proactive,,,,,,,,,,,,,,,,,,4.8 out of 5.0 rating for cost,Average Project Cost Breakdown,https://clutch.co/profile/modelit?project_cost=10000#reviews,"$10,000 to $49,000 (2)",https://clutch.co/profile/modelit?project_cost=50000#reviews,"$50,000 to $199,999 (2)",https://clutch.co/profile/modelit?project_cost=less_10000#reviews,"Less than $10,000 (1)",https://clutch.co/profile/modelit?project_cost=1000000#reviews,"$200,000 to $999,999 (1)",https://clutch.co/profile/modelit?project_cost=10000000#reviews,"$1,000,000 to $9,999,999 (0)",What Clients Have Said,"Modelit has received positive feedback regarding their overall cost and value for money. Clients highlighted that their pricing aligns well with budgets, with one stating it offered 'good value for cost.' Another client emphasized Modelit's affordability compared to local options, describing them as 'just as good as an internal resource.' Overall, the sentiment reflects satisfaction with the value provided relative to the costs incurred, indicating a strong perception of Modelit as a cost-effective partner.",Read All Reviews,https://clutch.co/profile/modelit#reviews,Was this helpful?,,,,,,,,Completed projects in 4 cities,"Bridgewater, New Jersey (1)",https://clutch.co/profile/modelit#reviews,"Manhattan, New York (1)","Bellevue, Washington (1)",https://clutch.co/profile/modelit#reviews,"Seattle, Washington (3)",https://clutch.co/profile/modelit#reviews,,,,Was this helpful?,,2 reviews mention CRM Consulting and SI,1 of 2 CRM Consulting and SI reviews are 5 stars,2 new reviews for CRM Consulting and SI in past 6 months,"$50,000 – $199,999 avg. project cost",CRM Consulting and SI PROJECT HIGHLIGHT,CRM Development & UX Design for Real Estate Services Co,"—  Modelit provided CRM development services for a real estate services company. The team was responsible for the CRM's solution architecture, workflow design, product configuration, and UX design.",5,Read more,https://clutch.co/go-to-review/modelit/356787,Read 2 Reviews,https://clutch.co/profile/modelit?service_provided=CRM%20Consulting%20and%20SI#reviews,Was this helpful?,,https://clutch.co/profile/modelit?project_cost=more_10000000#reviews,"$10,000,000 + (0)",,,,,,,,
https://clutch.co/profile/uds-systems-0,https://r.clutch.co/redirect?analyticsjs=true&category=Marketing+Automation&content_group=directory&debug_mode=false&event_category=visit_website&event_label=1812202&from_page=https%3A%2F%2Fclutch.co%2Fit-services%2Fmarketing-automation&is_sponsor=false&keyword=Marketing+Automation&no_click=1&page_canonical_id=1230000000000&page_location=https%3A%2F%2Fclutch.co%2Fit-services%2Fmarketing-automation&page_number=0&page_type=directory&pid=1812202&position=39&source=directory&trace_id=94a59e4b7941ea32&transport_url=https%3A%2F%2Fg.clutch.co&u=https%3A%2F%2Fuds.systems%2F%3Futm_source%3Dclutch.co%26utm_medium%3Dreferral%26utm_campaign%3Ddirectory,http://www.tractioncrm.com,UDS Systems,"UDS Systems is a CRM Consulting and Systems Integration company specializing in CRM migration and custom solution development. The reviews highlight their ability to deliver projects on time with high client satisfaction. Approximately 100% of the feedback mentions successful project delivery, but some suggest improved alignment on requirements could enhance their services.",5,5,"4
                        
                            reviews","$10,000+",$50 - $99 / hr,50 - 249,"Kyiv, Ukraine",45% CRM Consulting and SI,20% Custom Software Development,15% IT Strategy Consulting,2,10% Robotics Process Automation,10% Web Design,,,,15% Marketing automation,60% CRM Customer Support,25% Sales automation,,,See all 4 projects,Proactive,Reviews mention Proactive,"Clients consistently praise UDS Systems for their proactive engagement and responsiveness throughout projects. One client highlighted their 'proactive and responsive approach' in addressing needs and implementing new features efficiently. Another noted their commitment to timely deliverables and agile project management, reflecting a strong adherence to milestones. Overall, the sentiment regarding UDS Systems' proactive nature is overwhelmingly positive, emphasizing their dedication to continuous improvement and client satisfaction.",Custom Software Dev for Fleet Management Company,"Mar 13, 2024","Furthermore, UDS Systems exhibited a . Their professionalism was evident in their ability to implement new features seamlessly. They showcased a deep understanding of the evolving landscape of innovative technologies and Microsoft updates, .",Read Full Review,https://clutch.co/go-to-review/uds-systems-0/275289,,,,,,,proactive and responsive approach to addressing our needs,Read All Reviews,https://clutch.co/profile/uds-systems-0#reviews,Was this helpful?,5.0 out of 5.0 rating for cost,Average Project Cost Breakdown,https://clutch.co/profile/uds-systems-0?project_cost=10000000#reviews,"$1,000,000 to $9,999,999 (2)",https://clutch.co/profile/uds-systems-0?project_cost=10000#reviews,"$10,000 to $49,000 (1)",https://clutch.co/profile/uds-systems-0?project_cost=1000000#reviews,"$200,000 to $999,999 (1)",https://clutch.co/profile/uds-systems-0?project_cost=less_10000#reviews,"Less than $10,000 (0)",https://clutch.co/profile/uds-systems-0?project_cost=50000#reviews,"$50,000 to $199,999 (0)",What Clients Have Said,"Clients consistently highlight UDS Systems' competitive pricing and excellent value for money. For instance, one client noted that the 'pricing fits our budget' and emphasized 'good value for cost.' Another mentioned staying 'on budget' while receiving more features than expected. Overall, the sentiment reflects satisfaction with both the cost-effectiveness and the quality of services provided, establishing UDS Systems as a reliable partner for various project needs.",Read All Reviews,https://clutch.co/profile/uds-systems-0#reviews,Was this helpful?,,,,,,,,Completed projects in 3 countries,Finland (1),https://clutch.co/profile/uds-systems-0#reviews,Germany (2),Sweden (1),https://clutch.co/profile/uds-systems-0#reviews,,,,,,Was this helpful?,consistently providing valuable suggestions and recommendations for optimizing project outcomes,1 review mentions CRM Consulting and SI,1 of 1 CRM Consulting and SI reviews are 5 stars,"$10,000 – $49,000 avg. project cost",,CRM Consulting and SI PROJECT HIGHLIGHT,CRM Platform Development for Customer Experience Services Co,—  UDS Systems has developed an online CRM platform for a customer experience services company. UDS Systems has migrated the client's data from their in-house CRM to the new system they're developing.,5,Read more,https://clutch.co/go-to-review/uds-systems-0/247653,Read 1 Review,https://clutch.co/profile/uds-systems-0?service_provided=CRM%20Consulting%20and%20SI#reviews,Was this helpful?,,https://clutch.co/profile/uds-systems-0?project_cost=more_10000000#reviews,"$10,000,000 + (0)",,,,,,,,
https://clutch.co/profile/traction-consulting-group,https://r.clutch.co/redirect?analyticsjs=true&category=Marketing+Automation&content_group=directory&debug_mode=false&event_category=visit_website&event_label=22682&from_page=https%3A%2F%2Fclutch.co%2Fit-services%2Fmarketing-automation&is_sponsor=false&keyword=Marketing+Automation&no_click=1&page_canonical_id=1230000000000&page_location=https%3A%2F%2Fclutch.co%2Fit-services%2Fmarketing-automation&page_number=0&page_type=directory&pid=22682&position=40&source=directory&trace_id=94a59e4b7941ea32&transport_url=https%3A%2F%2Fg.clutch.co&u=http%3A%2F%2Fwww.tractioncrm.com%2F%3Futm_source%3Dclutch.co%26utm_medium%3Dreferral%26utm_campaign%3Ddirectory,https://solwey.com,Traction Consulting Group,"Traction Consulting Group is an ERP and CRM solutions provider specializing in Odoo implementations, system integrations, and custom software development. Their clients, spanning multiple industries, consistently praise the firm for its effective project management, timely communication, and strong cultural alignment. With nearly 100% positive feedback, clients frequently commend their responsiveness, technical expertise, and ability to meet deadlines while delivering projects within budget.",4.9,5,"18
                        
                            reviews","$10,000+",$150 - $199 / hr,10 - 49,"Wixom, MI",25% CRM Consulting and SI,20% BI & Big Data Consulting & SI,20% Custom Software Development,3,15% ERP Consulting and SI,10% Mobile App Development,10% Web Design,,,10% Marketing automation,40% Sales automation,25% CRM Customer Support,1,25% Other CRM focus,See all 18 projects,Understands their clients' needs,Reviews mention Understands their clients' needs,"Traction Consulting Group demonstrates a strong understanding of client needs, as evidenced by multiple reviews. Clients appreciate their ability to grasp complex business environments and tailor solutions accordingly. For instance, one client noted their impressive adaptability to a 'quirky' organizational culture, while another highlighted their proactive communication and insightful questioning during project scoping. Overall, the sentiment is overwhelmingly positive, with clients expressing satisfaction and confidence in Traction's commitment to aligning with their specific requirements.",Data Warehouse Dev in SQL for Workforce Management Firm,"Sep 10, 2020",The team is . We’ve really enjoyed working with them so far.,Read Full Review,https://clutch.co/go-to-review/traction-consulting-group/61166,Data Warehouse & Consulting for IT Staffing Company,5,"May 22, 2018","They’ve done a really good job . They break things down to the business stakeholders using a really simple three-bullet PowerPoint, so that the business understands how they can motivate Traction.",Read Full Review,https://clutch.co/go-to-review/traction-consulting-group/82027,understanding of our culture and environment,Read All Reviews,https://clutch.co/profile/traction-consulting-group#reviews,Was this helpful?,4.7 out of 5.0 rating for cost,Average Project Cost Breakdown,https://clutch.co/profile/traction-consulting-group?project_cost=50000#reviews,"$50,000 to $199,999 (9)",https://clutch.co/profile/traction-consulting-group?project_cost=10000#reviews,"$10,000 to $49,000 (6)",https://clutch.co/profile/traction-consulting-group?project_cost=1000000#reviews,"$200,000 to $999,999 (2)",https://clutch.co/profile/traction-consulting-group?project_cost=less_10000#reviews,"Less than $10,000 (0)",https://clutch.co/profile/traction-consulting-group?project_cost=10000000#reviews,"$1,000,000 to $9,999,999 (0)",What Clients Have Said,"Clients consistently praise Traction Consulting Group for their competitive pricing and exceptional value for money. One client noted that their pricing fit their budget while delivering great value, stating they were impressed with the overall cost-effectiveness of the project. Another client highlighted that Traction's services were 30%-40% cheaper than competitors, yet maintained high quality. Overall, the sentiment reflects satisfaction with the pricing structure and the quality of services rendered.",Read All Reviews,https://clutch.co/profile/traction-consulting-group#reviews,Was this helpful?,,,,,,,,Completed projects in 10 cities,"Addison, Texas (1)",https://clutch.co/profile/traction-consulting-group#reviews,"Detroit, Michigan (7)","Grand Rapids, Michigan (1)",https://clutch.co/profile/traction-consulting-group#reviews,"Jackson, Michigan (1)",https://clutch.co/profile/traction-consulting-group#reviews,"Lansing, Michigan (1)",https://clutch.co/profile/traction-consulting-group#reviews,"Livonia, Michigan (1)",Was this helpful?,understanding our business,,,,,,,,,,,,,,,https://clutch.co/profile/traction-consulting-group?project_cost=more_10000000#reviews,"$10,000,000 + (0)",Very responsive,More responsive than most other service providers,Traction Consulting Group is very responsive,They are a great candidate to start a conversation with. Send them a short message or project inquiry.,Get in Touch,https://clutch.co/profile/traction-consulting-group#contact,Was this helpful?,
