,,Actual Website,,,,,,,,,,,,,,,,,,,,,,,,,,,,,,,,,,,,,,,,,,,,,,,,,,,,,,,,,,,,,,,,,,,,,,,,,,,,,,,,,,,,,,,,,,,,,,,,,,,,,,,
https://clutch.co/profile/properexpression,https://r.clutch.co/redirect?analyticsjs=true&category=Marketing+Automation&content_group=directory&debug_mode=false&event_category=visit_website&event_label=1645311&from_page=https%3A%2F%2Fclutch.co%2Fit-services%2Fmarketing-automation&is_sponsor=false&keyword=Marketing+Automation&no_click=1&page_canonical_id=1230000000000&page_location=https%3A%2F%2Fclutch.co%2Fit-services%2Fmarketing-automation&page_number=0&page_type=directory&pid=1645311&position=10&source=directory&trace_id=94a59e4b7941ea32&transport_url=https%3A%2F%2Fg.clutch.co&u=https%3A%2F%2Fwww.properexpression.com%3Futm_source%3Dclutch.co%26utm_medium%3Dreferral%26utm_campaign%3Dprofile-view,https://launchpadlab.com,ProperExpression,"ProperExpression is a CRM Consultancy and Systems Integration company specializing in CRM implementation, integration, and consulting services. The company is praised for its exceptional project management skills, responsiveness, and ability to deliver projects on time. Key themes in their reviews include strong communication and understanding of client needs, with 100% of reviewers highlighting their effective CRM solutions, including a notable 80% reduction in CRM duplicates for one client.",5,5,"12
                        
                            reviews","$5,000+",$150 - $199 / hr,10 - 49,"McLean, VA",25% CRM Consulting and SI,15% Advertising,15% Content Marketing,3,15% Digital Strategy,15% Email Marketing,15% Search Engine Optimization,,,40% Marketing automation,40% Sales automation,20% CRM Social Relationship Management,,,See all 12 projects,Detail-oriented,Reviews mention Detail-oriented,"Clients consistently commend ProperExpression for their exceptional attention to detail. One client highlighted the team's insightful questions and thorough note-taking during initial discussions, which reflected their diligence. They noted, 'The company goes above and beyond to learn about its customer and provide a custom solution.' Overall, the sentiment is overwhelmingly positive, emphasizing the firm's meticulous approach and commitment to understanding client needs.",SEO & Social Media Marketing for Political Candidate,"Jan 12, 2022","The workflow was terrific. ProperExpression was easy to work with, quick to respond, and provided substantive feedback. . The company goes above and beyond to learn about its customer and provide a custom solution.",Read Full Review,https://clutch.co/go-to-review/properexpression/8364,,,,,,,Their attention to detail and personal touch,Read All Reviews,https://clutch.co/profile/properexpression#reviews,Was this helpful?,,,,,,,,,,,,,,,,,,Reviewed 1 time in the past 6 months,0 of 1 reviews is 5 stars,Unknown avg. project cost,"In the last six months, ProperExpression has received highly positive feedback for their digital marketing services, particularly in enhancing inbound lead generation and rebuilding client websites. A CEO noted their impressive results, including a fourfold increase in campaign effectiveness at half the cost, and praised their collaborative approach and deep expertise. Clients highlighted their strong communication and timely project management, with no significant areas for improvement identified.",Read 1 Recent Review,https://clutch.co/profile/properexpression?sort_by=date_desc#reviews,Was this helpful?,,,,,,,,,,,,,,4 reviews mention CRM Consulting and SI,4 of 4 CRM Consulting and SI reviews are 5 stars,"$10,000 – $49,000 avg. project cost",,CRM Consulting and SI PROJECT HIGHLIGHT,"Web Dev, Design, CRM Consulting & SI for HealthTech Company",—  ProperExpression has developed and designed a WordPress website for a healthtech company. They've also implemented SEO techniques and built a HubSpot from scratch with email automation and a,5,Read more,https://clutch.co/go-to-review/properexpression/239802,Read 4 Reviews,https://clutch.co/profile/properexpression?service_provided=CRM%20Consulting%20and%20SI#reviews,Was this helpful?,,,,Very responsive,More responsive than most other service providers,ProperExpression is very responsive,They are a great candidate to start a conversation with. Send them a short message or project inquiry.,Get in Touch,https://clutch.co/profile/properexpression#contact,Was this helpful?,
https://clutch.co/profile/launchpad-lab,https://r.clutch.co/redirect?analyticsjs=true&category=Marketing+Automation&content_group=directory&debug_mode=false&event_category=visit_website&event_label=19946&from_page=https%3A%2F%2Fclutch.co%2Fit-services%2Fmarketing-automation&is_sponsor=false&keyword=Marketing+Automation&no_click=1&page_canonical_id=1230000000000&page_location=https%3A%2F%2Fclutch.co%2Fit-services%2Fmarketing-automation&page_number=0&page_type=directory&pid=19946&position=11&source=directory&trace_id=94a59e4b7941ea32&transport_url=https%3A%2F%2Fg.clutch.co&u=https%3A%2F%2Flaunchpadlab.com%2F%3Futm_source%3Dclutch.co%26utm_medium%3Dreferral%26utm_campaign%3Dit-services-marketing-automation,https://www.deaninfotech.com,LaunchPad Lab,"LaunchPad Lab is a CRM consulting and systems integration company that excels in CRM implementation and integration services. Reviewers consistently praise their knowledgeable and responsive team, with 100% noting timely project delivery and effective communication. Additionally, 50% of reviewers highlight their expertise in enhancing internal CRM systems, leading to improved user satisfaction and operational efficiency.",4.8,5,"42
                        
                            reviews","$10,000+",$150 - $199 / hr,50 - 249,"Chicago, IL",20% CRM Consulting and SI,20% AI Consulting,20% AI Development,2,20% Custom Software Development,20% Web Development,,,,25% Marketing automation,50% Sales automation,25% CRM Customer Support,,,See all 42 projects,Proactive,Reviews mention Proactive,"Clients consistently commend LaunchPad Lab for their proactive approach, noting their eagerness to understand project goals and make valuable recommendations. One client highlighted their ability to create a user-friendly website tailored to specific audiences, while another praised their responsiveness in project management and adherence to timelines. Overall, the sentiment is highly positive, with clients appreciating the team's creativity and advice, although some expressed a desire for quicker responses in ongoing engagements.",Web Design for Eye Health Nonprofit,"Apr 3, 2017","They have a  they think will support our goal. Their quality control and review is very strong, and I like their design work. It’s been a pleasure working with them.",Read Full Review,https://clutch.co/go-to-review/launchpad-lab/102292,Custom Software Dev & UX/UI Design for Consulting Co,5,"Dec 18, 2024","Launch Pad Labs finished the first phase of work in record time! They , and delivered our MVP ahead of schedule! They were very flexible, especially when we had changes in priorities. They always .",Read Full Review,https://clutch.co/go-to-review/launchpad-lab/338492,proactive approach to making recommendations,Read All Reviews,https://clutch.co/profile/launchpad-lab#reviews,Was this helpful?,,,,,,,,,,,,,,,,,,Reviewed 3 times in the past 6 months,3 of 3 reviews are 5 stars,1 new review for CRM Consulting and SI services,"In the last six months, client feedback for LaunchPad Lab has been overwhelmingly positive. Clients praised the team for their responsiveness, technical expertise, and ability to deliver projects ahead of schedule. Notably, one VP highlighted their capacity to act as thought partners, providing valuable suggestions and solutions. Another client appreciated the seamless integration achieved with their platform. Overall, clients expressed satisfaction with the quality of work and alignment with project goals, indicating a strong fit for future collaborations.",Read 3 Recent Reviews,https://clutch.co/profile/launchpad-lab?sort_by=date_desc#reviews,Was this helpful?,,,,,,,,,,,,,"approached the works as true thought partners, made great suggestions, identified issues",2 reviews mention CRM Consulting and SI,2 of 2 CRM Consulting and SI reviews are 5 stars,1 new review for CRM Consulting and SI in past 6 months,"$200,000 – $999,999 avg. project cost",CRM Consulting and SI PROJECT HIGHLIGHT,"Web Dev, CRM SI & Email Mktg for Financial Services Company",—  LaunchPad Lab has developed a website for a financial services company. The team has created a HubSpot marketing email template and provided access and documentation for a HubSpot environment and,5,Read more,https://clutch.co/go-to-review/launchpad-lab/362132,Read 2 Reviews,https://clutch.co/profile/launchpad-lab?service_provided=CRM%20Consulting%20and%20SI#reviews,Was this helpful?,"$50,000 – $199,999 avg. project cost",,,Very responsive,More responsive than most other service providers,LaunchPad Lab is very responsive,They are a great candidate to start a conversation with. Send them a short message or project inquiry.,Get in Touch,https://clutch.co/profile/launchpad-lab#contact,Was this helpful?,
https://clutch.co/profile/dean-infotech,https://r.clutch.co/redirect?analyticsjs=true&category=Marketing+Automation&content_group=directory&debug_mode=false&event_category=visit_website&event_label=151204&from_page=https%3A%2F%2Fclutch.co%2Fit-services%2Fmarketing-automation&is_sponsor=false&keyword=Marketing+Automation&no_click=1&page_canonical_id=1230000000000&page_location=https%3A%2F%2Fclutch.co%2Fit-services%2Fmarketing-automation&page_number=0&page_type=directory&pid=151204&position=12&source=directory&trace_id=94a59e4b7941ea32&transport_url=https%3A%2F%2Fg.clutch.co&u=https%3A%2F%2Fwww.deaninfotech.com%2F,https://shaligraminfotech.com,Dean Infotech™ Pvt. Ltd.,"Dean Infotech Pvt. Ltd. is a versatile IT company providing services like web and mobile app development, database management, and digital marketing. Praised for their project management, quick issue resolution, and tailored solutions, they maintain a high satisfaction rate, with over 90% of reviewers highlighting their responsiveness and expertise. Many clients commend their ability to meet budget constraints while delivering quality results.",4.9,5,"14
                        
                            reviews","$5,000+",$25 - $49 / hr,50 - 249,"Faridabad, India",30% CRM Consulting and SI,10% Custom Software Development,10% Low/No Code Development,9,10% Web Development,5% E-Commerce Development,5% ERP Consulting and SI,5% IT Managed Services,5% IT Staff Augmentation,30% Marketing automation,45% Sales automation,10% CRM Social Relationship Management,2,10% Other CRM focus,See all 14 projects,Well-organized projects,Reviews mention Well-organized projects,"Clients have praised Dean Infotech Pvt. Ltd. for their well-organized project management, highlighting clear communication and regular progress updates. One client noted the team's responsiveness and proactive approach, which contributed to successful outcomes such as increased website traffic and improved search engine rankings. Overall, the sentiment reflects high satisfaction with the structured and efficient handling of projects.",Website Design & Dev for Financial Consulting Company,"Apr 1, 2024","The , with , and timelines. Team was responsive to our needs and were highly attentive and proactive.",Read Full Review,https://clutch.co/go-to-review/dean-infotech/279148,,,,,,,project management was well-organized,Read All Reviews,https://clutch.co/profile/dean-infotech#reviews,Was this helpful?,5.0 out of 5.0 rating for cost,Average Project Cost Breakdown,https://clutch.co/profile/dean-infotech?project_cost=less_10000#reviews,"Less than $10,000 (2)",https://clutch.co/profile/dean-infotech?project_cost=10000#reviews,"$10,000 to $49,000 (2)",https://clutch.co/profile/dean-infotech?project_cost=50000#reviews,"$50,000 to $199,999 (0)",https://clutch.co/profile/dean-infotech?project_cost=1000000#reviews,"$200,000 to $999,999 (0)",https://clutch.co/profile/dean-infotech?project_cost=10000000#reviews,"$1,000,000 to $9,999,999 (0)",What Clients Have Said,"Clients consistently highlight Dean Infotech™ Pvt. Ltd.'s competitive pricing and exceptional value for money. Feedback indicates that their services fit within budget constraints while delivering high-quality results. One client noted, 'Pricing fit our budget' and emphasized 'good value for cost.' Another remarked on the company's ability to meet project specifications without exceeding costs, stating, 'Investing in their services was totally worth our every penny.' Overall, the sentiment reflects satisfaction with both cost-effectiveness and service quality.",Read All Reviews,https://clutch.co/profile/dean-infotech#reviews,Was this helpful?,,,,,,,,Completed projects in 3 countries,India (6),https://clutch.co/profile/dean-infotech#reviews,United States (1),England (1),https://clutch.co/profile/dean-infotech#reviews,,,,,,Was this helpful?,clear communication channels and regular progress updates,,,,,,,,,,,,,,,https://clutch.co/profile/dean-infotech?project_cost=more_10000000#reviews,"$10,000,000 + (0)",,,,,,,,5% CRM Customer Support
https://clutch.co/profile/shaligram-infotech,https://r.clutch.co/redirect?analyticsjs=true&category=Marketing+Automation&content_group=directory&debug_mode=false&event_category=visit_website&event_label=445842&from_page=https%3A%2F%2Fclutch.co%2Fit-services%2Fmarketing-automation&is_sponsor=false&keyword=Marketing+Automation&no_click=1&page_canonical_id=1230000000000&page_location=https%3A%2F%2Fclutch.co%2Fit-services%2Fmarketing-automation&page_number=0&page_type=directory&pid=445842&position=13&source=directory&trace_id=94a59e4b7941ea32&transport_url=https%3A%2F%2Fg.clutch.co&u=https%3A%2F%2Fshaligraminfotech.com%2F%3Futm_source%3Dclutch%26utm_medium%3Dreferral%26utm_campaign%3Dclutch_profile,https://www.npws.net,Shaligram Infotech,"Shaligram Infotech is a CRM Consulting and Systems Integration firm known for its exceptional CRM implementation and Customer Relationship Management Integration services. The company has garnered positive feedback from clients, emphasizing their effective project management, responsiveness, and commitment to customer satisfaction. Over 90% of reviewers highlight their ability to deliver tailored CRM solutions on time and within budget.",4.9,5,"41
                        
                            reviews","$5,000+",$25 - $49 / hr,50 - 249,"Ahmedabad, India",20% CRM Consulting and SI,20% Custom Software Development,20% Mobile App Development,4,10% AI Development,10% Cloud Consulting & SI,10% UX/UI Design,10% Web Development,,20% Marketing automation,40% Sales automation,20% CRM Customer Support,2,10% CRM Social Relationship Management,See all 41 projects,Transparent,Reviews mention Transparent,"Clients have expressed a positive sentiment regarding Shaligram Infotech's transparency, highlighting their structured processes and commitment to clear communication. One client noted their impressive focus on meeting deadlines and stakeholder expectations, stating that the company delivered on time and adhered to budget constraints. The adaptable project management approach was also appreciated, although a suggestion for improvement included providing better user documentation to enhance the overall user experience.",Custom Software System Dev for IT Services Co,"Feb 26, 2025","Their structured processes emphasize meeting deadlines and stakeholder expectations, supported by .",Read Full Review,https://clutch.co/go-to-review/shaligram-infotech/355568,,,,,,,transparent communication and commitment to agreed timelines and budgets,Read All Reviews,https://clutch.co/profile/shaligram-infotech#reviews,Was this helpful?,4.8 out of 5.0 rating for cost,Average Project Cost Breakdown,https://clutch.co/profile/shaligram-infotech?project_cost=10000#reviews,"$10,000 to $49,000 (15)",https://clutch.co/profile/shaligram-infotech?project_cost=less_10000#reviews,"Less than $10,000 (12)",https://clutch.co/profile/shaligram-infotech?project_cost=1000000#reviews,"$200,000 to $999,999 (1)",,,,,What Clients Have Said,"Clients consistently highlight Shaligram Infotech's competitive pricing and excellent value for money. For instance, one client noted that their pricing fit well within budget while providing good value, stating, 'Good value for cost.' Another client echoed similar sentiments, emphasizing that their pricing was a key factor in choosing Shaligram over competitors. Overall, the feedback reflects a strong sentiment of satisfaction regarding cost-effectiveness without compromising on quality or service.",Read All Reviews,https://clutch.co/profile/shaligram-infotech#reviews,Was this helpful?,,,,,,,,,,,,,,,,,,,,,8 reviews mention CRM Consulting and SI,7 of 8 CRM Consulting and SI reviews are 5 stars,5 new reviews for CRM Consulting and SI in past 6 months,"Less than $10,000 avg. project cost",CRM Consulting and SI PROJECT HIGHLIGHT,"Staff Aug, CRM Consulting & App Mgmt for IT Services Co","—  Shaligram Infotech has implemented Dynamics 365, Business Central, Customer Engagements, and Shopify for an IT services company. The team has also provided resource augmentation and product",5,Read more,https://clutch.co/go-to-review/shaligram-infotech/320642,Read 8 Reviews,https://clutch.co/profile/shaligram-infotech?service_provided=CRM%20Consulting%20and%20SI#reviews,Was this helpful?,,,,Very responsive,More responsive than most other service providers,Shaligram Infotech is very responsive,They are a great candidate to start a conversation with. Send them a short message or project inquiry.,Get in Touch,https://clutch.co/profile/shaligram-infotech#contact,Was this helpful?,10% Other CRM focus
https://clutch.co/profile/new-perspective-marketing,https://r.clutch.co/redirect?analyticsjs=true&category=Marketing+Automation&content_group=directory&debug_mode=false&event_category=visit_website&event_label=434436&from_page=https%3A%2F%2Fclutch.co%2Fit-services%2Fmarketing-automation&is_sponsor=false&keyword=Marketing+Automation&no_click=1&page_canonical_id=1230000000000&page_location=https%3A%2F%2Fclutch.co%2Fit-services%2Fmarketing-automation&page_number=0&page_type=directory&pid=434436&position=14&source=directory&trace_id=94a59e4b7941ea32&transport_url=https%3A%2F%2Fg.clutch.co&u=https%3A%2F%2Fwww.npws.net%2F%3Futm_source%3Dclutch.co%26utm_medium%3Dreferral%26utm_campaign%3Ddirectory,https://brandlyft.io,New Perspective Marketing,"New Perspective Marketing is a CRM Consulting firm excelling in CRM Implementation and Integration. The reviews are overwhelmingly positive, with a strong emphasis on their effective project management and alignment with client values. They are praised for streamlining processes and enhancing LinkedIn engagement, demonstrating their focus on sustainability and impactful change.",4.9,4.5,"10
                        
                            reviews","$5,000+",$150 - $199 / hr,10 - 49,"Worcester, MA",10% CRM Consulting and SI,25% Digital Strategy,15% Web Design,5,10% Content Marketing,10% Conversion Optimization,10% Demand Generation Marketing,10% Pay Per Click,10% Search Engine Optimization,35% Marketing automation,30% Sales automation,15% CRM Social Relationship Management,2,10% CRM Customer Support,See all 10 projects,Unique expertise,Reviews mention Unique expertise,"New Perspective Marketing is consistently recognized for its unique expertise in digital marketing, with clients highlighting their strong strategic approach and creativity. One client noted their exceptional ability to deliver a comprehensive marketing strategy tailored to specific needs, while another praised their data-driven execution and the significant impact on lead generation. Overall, the sentiment reflects high satisfaction with their industry knowledge and commitment to client success, with no areas for improvement identified.",Web Design & Digital Mktg for Environmental Services Company,"Nov 17, 2021","The team’s standout strengths are that they . They execute, deliver, and own it.",Read Full Review,https://clutch.co/go-to-review/new-perspective-marketing/4921,Digital Marketing for Solar & Energy Efficiency Company,5,"Oct 11, 2021",Our Account Manager is also a developer. He has been able to help us with .,Read Full Review,https://clutch.co/go-to-review/new-perspective-marketing/31614,communicate concisely and are extremely data driven experts in their field,Read All Reviews,https://clutch.co/profile/new-perspective-marketing#reviews,Was this helpful?,4.6 out of 5.0 rating for cost,Average Project Cost Breakdown,https://clutch.co/profile/new-perspective-marketing?project_cost=50000#reviews,"$50,000 to $199,999 (7)",https://clutch.co/profile/new-perspective-marketing?project_cost=10000#reviews,"$10,000 to $49,000 (1)",https://clutch.co/profile/new-perspective-marketing?project_cost=less_10000#reviews,"Less than $10,000 (0)",https://clutch.co/profile/new-perspective-marketing?project_cost=1000000#reviews,"$200,000 to $999,999 (0)",https://clutch.co/profile/new-perspective-marketing?project_cost=10000000#reviews,"$1,000,000 to $9,999,999 (0)",What Clients Have Said,"Clients consistently highlight New Perspective Marketing's competitive pricing and value for money. For instance, one client noted that their pricing fit well within their budget while providing substantial marketing expertise. Another client emphasized that New Perspective helped maximize their marketing spend, ensuring a strong return on investment. Overall, the sentiment indicates that clients perceive New Perspective as delivering high-quality services that justify their costs, with many expressing satisfaction with the outcomes relative to their financial commitments.",Read All Reviews,https://clutch.co/profile/new-perspective-marketing#reviews,Was this helpful?,Reviewed 2 times in the past 6 months,1 of 2 reviews are 5 stars,1 new review for CRM Consulting and SI services,"Recent reviews of New Perspective Marketing highlight their effective project management and client-centric approach. Clients praised their timely delivery and extensive knowledge, with one noting, 'Client Success Manager, Madison Filipak, is one of the best in the business.' Another client reported improved engagement metrics and a streamlined sales process. Overall, sentiment is highly positive, with no significant areas for improvement identified, indicating a strong alignment with client needs and values.",Read 2 Recent Reviews,https://clutch.co/profile/new-perspective-marketing?sort_by=date_desc#reviews,Was this helpful?,,,,,,,,,,,,,unique projects and is even an expert with some of our automation tools,,,,,,,,,,,,,,"$10,000 – $49,000 avg. project cost",https://clutch.co/profile/new-perspective-marketing?project_cost=more_10000000#reviews,"$10,000,000 + (0)",Very responsive,More responsive than most other service providers,New Perspective Marketing is very responsive,They are a great candidate to start a conversation with. Send them a short message or project inquiry.,Get in Touch,https://clutch.co/profile/new-perspective-marketing#contact,Was this helpful?,10% Other CRM focus
