,,Actual Website,,,,,,,,,,,,,,,,,,,,,,,,,,,,,,,,,,,,,,,,,,,,,,,,,,,,,,,,,,,,,,,,,,,,,,,,,,,,,,,,,,,,,,,,,,,,,,,,,,,,,,,
sg-provider-logotype-v2 href,provider__cta-link href 5,https://andersenlab.com,provider__title-link,provider__description-text-more,sg-rating__number,sg-rating__number 2,sg-rating__reviews,provider__highlights-item,provider__highlights-item 2,provider__highlights-item 3,provider__highlights-item 4,provider__services-list-item,provider__services-list-item 2,provider__service-list-item-text,provider__services-list-item-more,provider__services-list-item 3,provider__services-list-item 4,provider__services-list-item 5,provider__services-list-item 6,provider__services-list-item 7,provider__services-list-item 9,provider__services-list-item 10,provider__service-list-item-text 2,provider__services-list-item-more 2,provider__services-list-item 11,provider__project-highlight-projects-link,sg-tabs-expanded__tab,provider-insight__title,provider-insight__description,provider-insight__review-title,provider-insight__review-date,provider-insight__review-snippet,provider-insight__review-show-full-review,provider-insight__review-show-full-review href,provider-insight__review-title 2,sg-rating__number 3,provider-insight__review-date 2,provider-insight__review-snippet 2,provider-insight__review-show-full-review 2,provider-insight__review-show-full-review href 2,provider-insight__review-snippet 5,provider__cta-link,provider__cta-link href,feedback__message,sg-tabs-expanded__tab 2,statistic__title,statistic__item-link href,statistic__item-title,statistic__item-link href 2,statistic__item-title 2,statistic__item-link href 3,statistic__item-title 3,statistic__item-link href 4,statistic__item-title 4,statistic__item-link href 5,statistic__item-title 5,provider-insight__title 2,provider-insight__description 2,provider__cta-link 2,provider__cta-link href 2,feedback__message 2,sg-tabs-expanded__tab 3,features__item,features__item 2,provider-insight__description 3,provider__cta-link 3,provider__cta-link href 3,feedback__message 3,sg-tabs-expanded__tab 4,locations__link,locations__link href,locations__link 2,locations__link 3,locations__link href 3,locations__link 4,locations__link href 4,locations__link 5,locations__link href 5,locations__link 6,feedback__message 4,provider-insight__review-snippet 6,sg-tabs-expanded__tab 5,features__item 3,features__item 4,features__item 5,provider-insight__subtitle,provider-insight__title 4,provider-insight__description 4,provider-insight-highlight-rating,provider-insight__highlight-more-link,provider-insight__highlight-more-link href,provider__cta-link 6,provider__cta-link href 6,feedback__message 5,features__item 6,statistic__item-link href 6,statistic__item-title 6,sg-tabs-expanded__tab 6,provider-insight__responsive,provider-insight__title 5,provider-insight__description 5,provider__cta-link 7,provider__cta-link href 7,feedback__message 6,provider__services-list-item 13
https://clutch.co/profile/andersen,https://r.clutch.co/redirect?analyticsjs=true&category=Marketing+Automation&content_group=directory&debug_mode=false&event_category=visit_website&event_label=33493&from_page=https%3A%2F%2Fclutch.co%2Fit-services%2Fmarketing-automation&is_sponsor=false&keyword=Marketing+Automation&no_click=1&page_canonical_id=1230000000000&page_location=https%3A%2F%2Fclutch.co%2Fit-services%2Fmarketing-automation&page_number=0&page_type=directory&pid=33493&position=1&source=directory&trace_id=94a59e4b7941ea32&transport_url=https%3A%2F%2Fg.clutch.co&u=https%3A%2F%2Fandersenlab.com,https://action.set2close.io,Andersen Inc.,"Andersen Inc. is a comprehensive software development company specializing in digital solutions, IT infrastructure, and mobile application development. The company is praised for its high-quality resource management, timely project delivery, and deep technical expertise. Over 90% of reviews highlight Andersen's adaptability and integration into client teams, while 100% of feedback emphasizes their professional and proactive approach.",4.9,5,"126
                        
                            reviews","$50,000+",$50 - $99 / hr,"1,000 - 9,999","Warszawa, Poland",10% CRM Consulting and SI,20% Custom Software Development,15% IT Managed Services,6,15% Mobile App Development,10% AI Development,10% IT Strategy Consulting,10% Low/No Code Development,5% Enterprise App Modernization,20% Marketing automation,40% Sales automation,30% CRM Customer Support,1,10% CRM Social Relationship Management,See all 126 projects,Timely,Reviews mention Timely,"The overall sentiment regarding timeliness in Andersen Inc.'s project delivery is highly positive. Clients consistently noted that deliverables were met on time, with phrases such as 'the deliverables were always timely' and 'delivery time is always as expected.' One client highlighted that Andersen's team 'worked to time and budget across key projects,' while another emphasized that 'the project was completed on time and to our needs.' This reflects Andersen's strong commitment to meeting deadlines and effectively managing projects.",IT Staff Aug & Software Dev for Digital Solutions Provider,"Apr 30, 2024",Andersen was always able to bring in results in time and budget. They responded always on short notice.,Read Full Review,https://clutch.co/go-to-review/andersen/285614,Custom Software Dev & DevOps Services for Media Tech Company,4.5,"Jan 10, 2024",They delivered the project on time and to our needs. Very communicative and fast response time.,Read Full Review,https://clutch.co/go-to-review/andersen/260595,"Deadline Reached. Our needs were met, and Andersen was always super supportive.",Read All Reviews,https://clutch.co/profile/andersen#reviews,Was this helpful?,4.6 out of 5.0 rating for cost,Average Project Cost Breakdown,https://clutch.co/profile/andersen?project_cost=50000#reviews,"$50,000 to $199,999 (32)",https://clutch.co/profile/andersen?project_cost=10000#reviews,"$10,000 to $49,000 (27)",https://clutch.co/profile/andersen?project_cost=1000000#reviews,"$200,000 to $999,999 (20)",https://clutch.co/profile/andersen?project_cost=less_10000#reviews,"Less than $10,000 (6)",https://clutch.co/profile/andersen?project_cost=10000000#reviews,"$1,000,000 to $9,999,999 (5)",What Clients Have Said,"Clients consistently report that Andersen Inc. offers good value for money and competitive pricing. Feedback highlights their responsiveness and ability to meet project deadlines, with one client noting a 40% increase in release speed due to Andersen's involvement. Another client emphasized the company's flexibility and proactive approach, which contributed to successful project outcomes. Overall, clients appreciate the balance of cost and quality, with many expressing satisfaction with the outcomes and timely delivery of services.",Read All Reviews,https://clutch.co/profile/andersen#reviews,Was this helpful?,Reviewed 2 times in the past 6 months,2 of 2 reviews are 5 stars,"$200,000 – $999,999 avg. project cost","In recent reviews, Andersen Inc. has garnered positive feedback for its adaptability and technical expertise. Clients noted significant improvements in project outcomes, such as a 40% increase in mobile banking releases and a 20-point rise in customer NPS. The team's proactive approach and seamless integration into client workflows were particularly praised. However, suggestions for enhanced documentation transparency and deeper business context involvement were mentioned as potential areas for growth.",Read 2 Recent Reviews,https://clutch.co/profile/andersen?sort_by=date_desc#reviews,Was this helpful?,Completed projects in 30 countries,Australia (2),https://clutch.co/profile/andersen#reviews,Austria (3),Belgium (3),https://clutch.co/profile/andersen#reviews,Belarus (1),https://clutch.co/profile/andersen#reviews,Canada (1),https://clutch.co/profile/andersen#reviews,Croatia (1),Was this helpful?,,,,,,,,,,,,,,,,,,,,,,,,,
https://clutch.co/profile/set-2-close,https://r.clutch.co/redirect?analyticsjs=true&category=Marketing+Automation&content_group=directory&debug_mode=false&event_category=visit_website&event_label=1973086&from_page=https%3A%2F%2Fclutch.co%2Fit-services%2Fmarketing-automation&is_sponsor=false&keyword=Marketing+Automation&no_click=1&page_canonical_id=1230000000000&page_location=https%3A%2F%2Fclutch.co%2Fit-services%2Fmarketing-automation&page_number=0&page_type=directory&pid=1973086&position=2&source=directory&trace_id=94a59e4b7941ea32&transport_url=https%3A%2F%2Fg.clutch.co&u=https%3A%2F%2Faction.set2close.io%3Futm_source%3Dclutch.co%26utm_medium%3Dreferral%26utm_campaign%3Dit-services-marketing-automation,https://cloudmasonry.com,Set 2 Close,"Set 2 Close is a CRM Consulting and Systems Integration company that specializes in HubSpot onboarding and CRM implementation services. Their reviews reflect a strong emphasis on customer satisfaction, with 100% of reviewers highlighting their expertise, responsiveness, and ability to deliver on time. Notably, 80% of feedback specifically praises their knowledgeable and friendly team, underscoring their commitment to effective CRM solutions.",4.9,5,"51
                        
                            reviews","$5,000+",$200 - $300 / hr,10 - 49,"kamloops, Canada",80% CRM Consulting and SI,20% Business Consulting,,,,,,,,30% Marketing automation,70% Sales automation,,,,See all 51 projects,Customized support,Reviews mention Customized support,"Clients have consistently praised Set 2 Close for their customized support, highlighting their tailored training and responsiveness. One client noted the 'personalized approach to training' that aligned with specific business needs, resulting in a seamless learning experience. Another emphasized the value of one-on-one assistance, stating that Set 2 Close's guidance was 'quick to assist' and directly applicable. Overall, the sentiment reflects high satisfaction with their adaptive and proactive support, contributing significantly to clients' successful outcomes.",HubSpot Onboarding for Financial Services Company,"Jan 13, 2025","Set 2 Close's  helped me better understand how to use HubSpot. In addition to our weekly meetings, Kyle and Ari were  I had via email.",Read Full Review,https://clutch.co/go-to-review/set-2-close/342742,CRM & Marketing Consulting for Consulting Company,5,"Mar 17, 2025","They provided , One on One. After each meeting, they provided follow-up videos for information not covered in the meeting.",Read Full Review,https://clutch.co/go-to-review/set-2-close/360316,individualized approach,Read All Reviews,https://clutch.co/profile/set-2-close#reviews,Was this helpful?,,,,,,,,,,,,,,,,,,Reviewed 38 times in the past 6 months,36 of 38 reviews are 5 stars,38 new reviews for CRM Consulting and SI services,"Over the last six months, Set 2 Close has received overwhelmingly positive feedback from clients. Reviews highlight their exceptional responsiveness, flexibility, and expertise in HubSpot onboarding. Clients praised their ability to tailor solutions to unique business needs, with one stating, ""They went beyond my expectations"". Specific outcomes include significant improvements in sales processes and CRM efficiency. Overall, sentiment reflects strong satisfaction with their professional approach and commitment to client success.",Read 38 Recent Reviews,https://clutch.co/profile/set-2-close?sort_by=date_desc#reviews,Was this helpful?,Completed projects in 3 countries,Bulgaria (1),https://clutch.co/profile/set-2-close#reviews,Canada (10),United States (36),https://clutch.co/profile/set-2-close#reviews,,,,,,Was this helpful?,prompt to respond to any questions,40 reviews mention CRM Consulting and SI,37 of 40 CRM Consulting and SI reviews are 5 stars,38 new reviews for CRM Consulting and SI in past 6 months,"Less than $10,000 avg. project cost",CRM Consulting and SI PROJECT HIGHLIGHT,HubSpot Setup & Training for IT Services Company,—  Set 2 Close provided HubSpot onboarding services for an IT services company. The team set up the client's HubSpot account and trained them on executing campaigns and measuring deliverables.,5,Read more,https://clutch.co/go-to-review/set-2-close/351301,Read 40 Reviews,https://clutch.co/profile/set-2-close?service_provided=CRM%20Consulting%20and%20SI#reviews,Was this helpful?,"Less than $10,000 avg. project cost",,,,,,,,,,
https://clutch.co/profile/cloudmasonry,https://r.clutch.co/redirect?analyticsjs=true&category=Marketing+Automation&content_group=directory&debug_mode=false&event_category=visit_website&event_label=828370&from_page=https%3A%2F%2Fclutch.co%2Fit-services%2Fmarketing-automation&is_sponsor=false&keyword=Marketing+Automation&no_click=1&page_canonical_id=1230000000000&page_location=https%3A%2F%2Fclutch.co%2Fit-services%2Fmarketing-automation&page_number=0&page_type=directory&pid=828370&position=3&source=directory&trace_id=94a59e4b7941ea32&transport_url=https%3A%2F%2Fg.clutch.co&u=https%3A%2F%2Fcloudmasonry.com%3Futm_source%3Dclutch.co%26utm_medium%3Dreferral%26utm_campaign%3Dit-services-marketing-automation,https://elogic.co,CloudMasonry,"CloudMasonry is a CRM Consulting firm specializing in CRM Implementation and Systems Integration. Across their reviews, 100% of clients commend their proactive project management and technical expertise. Clients consistently highlight their exceptional responsiveness and ability to deliver high-quality results within agreed timelines, with no notable areas for improvement mentioned.",5,5,"14
                        
                            reviews","$10,000+",$150 - $199 / hr,50 - 249,"Chicago, IL",90% CRM Consulting and SI,10% Low/No Code Development,,,,,,,,30% Marketing automation,40% Sales automation,30% CRM Customer Support,,,See all 14 projects,Honest,Reviews mention Honest,"Clients have consistently praised CloudMasonry for their honesty and transparency throughout their engagements. One client noted, ""CloudMasonry is always true to their word about what they’re going to deliver,"" highlighting their commitment to meeting deadlines and staying within budget. Their approach fosters a strategic collaboration, where they actively engage with clients to understand needs, leading to effective solutions. Overall, the sentiment reflects a high level of trust and satisfaction with CloudMasonry's integrity and communication.",Salesforce Automation & Functionality Dev for Direct Energy,"Jan 27, 2021","CloudMasonry is always , and they’re consistently on time, sticking to or coming in under the budget. It’s really wonderful to work with a partner who’s . In addition, they’re . If they catch an issue, they’ll bring it to the forefront immediately.",Read Full Review,https://clutch.co/go-to-review/cloudmasonry/47650,,,,,,,true to their word about what they’re going to deliver,Read All Reviews,https://clutch.co/profile/cloudmasonry#reviews,Was this helpful?,5.0 out of 5.0 rating for cost,Average Project Cost Breakdown,https://clutch.co/profile/cloudmasonry?project_cost=10000#reviews,"$10,000 to $49,000 (4)",https://clutch.co/profile/cloudmasonry?project_cost=50000#reviews,"$50,000 to $199,999 (4)",https://clutch.co/profile/cloudmasonry?project_cost=less_10000#reviews,"Less than $10,000 (2)",https://clutch.co/profile/cloudmasonry?project_cost=1000000#reviews,"$200,000 to $999,999 (2)",https://clutch.co/profile/cloudmasonry?project_cost=10000000#reviews,"$1,000,000 to $9,999,999 (1)",What Clients Have Said,"Client feedback regarding CloudMasonry highlights a strong sentiment of value for money, with multiple reviews noting their competitive pricing and good value for cost. For instance, clients from Future PLC and Lehigh University praised CloudMasonry for being a great culture fit and delivering quality work within budget constraints. Additionally, a client from an insurance company emphasized the pricing fit for their budget, further reinforcing the positive perception of the company's affordability and overall value.",Read All Reviews,https://clutch.co/profile/cloudmasonry#reviews,Was this helpful?,Reviewed 1 time in the past 6 months,1 of 1 reviews is 5 stars,1 new review for CRM Consulting and SI services,"Recent reviews for CloudMasonry highlight their exceptional project management and proactive communication. A client from Future PLC praised their efficient Salesforce implementation, noting timely deliveries and strong foresight. The company's culture and alignment with client values were also commended, alongside their personable approach. Overall, feedback reflects a high level of satisfaction, with clients rating their experience as 10/10 and expressing no areas for improvement.",Read 1 Recent Review,https://clutch.co/profile/cloudmasonry?sort_by=date_desc#reviews,Was this helpful?,,,,,,,,,,,,,that transparent and visionary,5 reviews mention CRM Consulting and SI,5 of 5 CRM Consulting and SI reviews are 5 stars,3 new reviews for CRM Consulting and SI in past 6 months,"$50,000 – $199,999 avg. project cost",CRM Consulting and SI PROJECT HIGHLIGHT,Salesforce Support for Publishing Company,—  CloudMasonry provides Salesforce support to a publishing firm. The team has set up a new Salesforce Service Cloud instance and transferred all customer service emails from the legacy platform into,5,Read more,https://clutch.co/go-to-review/cloudmasonry/345465,Read 5 Reviews,https://clutch.co/profile/cloudmasonry?service_provided=CRM%20Consulting%20and%20SI#reviews,Was this helpful?,Unknown avg. project cost,https://clutch.co/profile/cloudmasonry?project_cost=more_10000000#reviews,"$10,000,000 + (0)",,,,,,,,
https://clutch.co/profile/elogic-commerce,https://r.clutch.co/redirect?analyticsjs=true&category=Marketing+Automation&content_group=directory&debug_mode=false&event_category=visit_website&event_label=33168&from_page=https%3A%2F%2Fclutch.co%2Fit-services%2Fmarketing-automation&is_sponsor=false&keyword=Marketing+Automation&no_click=1&page_canonical_id=1230000000000&page_location=https%3A%2F%2Fclutch.co%2Fit-services%2Fmarketing-automation&page_number=0&page_type=directory&pid=33168&position=4&source=directory&trace_id=94a59e4b7941ea32&transport_url=https%3A%2F%2Fg.clutch.co&u=https%3A%2F%2Felogic.co%2F%3Futm_source%3Dclutch.co%26utm_medium%3Dreferral%26utm_campaign%3Dreferral_profile,https://evenbound.com/clutch-hubspot-solutions-partner,Elogic Commerce,"Elogic Commerce is a CRM Consulting and Systems Integration firm specializing in providing precise project estimates, detailed technical proposals, and client consultations. Reviews indicate 100% positive feedback, highlighting their technical expertise, business acumen, and responsiveness. Clients appreciate their proactive approach and professional delivery, though some suggest increased availability during peak periods.",5,4.5,"36
                        
                            reviews","$25,000+",$25 - $49 / hr,50 - 249,"Kyiv, Ukraine",10% CRM Consulting and SI,40% E-Commerce Development,10% Blockchain,4,10% Custom Software Development,10% IT Managed Services,10% IoT Development,10% Web Design,,40% Marketing automation,40% Sales automation,20% CRM Customer Support,,,See all 36 projects,Reasonable pricing,Reviews mention Reasonable pricing,"Clients have consistently expressed satisfaction with Elogic Commerce's reasonable pricing, particularly in comparison to the Australian market. One client noted, ""We get good quality for a reasonable price compared to the Australian market,"" highlighting the company's ability to deliver quality services without excessive costs. The transparent billing structure, which is time-based, has also been appreciated, though some clients suggested that a fixed price option could be beneficial for others.",Magento 2 Dev for Fashion Marketplace,"Feb 10, 2021","If you have a Magento site and want , work with Elogic.",Read Full Review,https://clutch.co/go-to-review/elogic-commerce/65030,Magento Development for Luxury Watches & Jewelry Company,5,"Nov 4, 2020",We get good quality for a . They have enough resources to facilitate all of our requests. They also learn on the go.,Read Full Review,https://clutch.co/go-to-review/elogic-commerce/106563,quality work for a reasonable price,Read All Reviews,https://clutch.co/profile/elogic-commerce#reviews,Was this helpful?,4.9 out of 5.0 rating for cost,Average Project Cost Breakdown,https://clutch.co/profile/elogic-commerce?project_cost=10000#reviews,"$10,000 to $49,000 (16)",https://clutch.co/profile/elogic-commerce?project_cost=50000#reviews,"$50,000 to $199,999 (8)",https://clutch.co/profile/elogic-commerce?project_cost=1000000#reviews,"$200,000 to $999,999 (2)",https://clutch.co/profile/elogic-commerce?project_cost=less_10000#reviews,"Less than $10,000 (1)",,,What Clients Have Said,"Clients have consistently praised Elogic Commerce for delivering excellent value for money, often highlighting their pricing alignment with project budgets and the high quality of work delivered. For instance, one client noted, 'Pricing fit our budget, great culture fit, good value for cost.' Another mentioned, 'The project was completed on time and under the estimated budget,' showcasing their commitment to cost efficiency. Overall, clients express satisfaction with the balance of cost and quality, indicating Elogic Commerce as a worthwhile investment.",Read All Reviews,https://clutch.co/profile/elogic-commerce#reviews,Was this helpful?,Reviewed 6 times in the past 6 months,6 of 6 reviews are 5 stars,"$10,000 – $49,000 avg. project cost","In the last six months, client feedback for Elogic Commerce has been overwhelmingly positive. Clients praised their effective communication, timely delivery, and thorough understanding of project requirements. For instance, one client highlighted how Elogic's insights helped avoid costly missteps in their Shopify project. Another noted significant performance improvements post-migration to the Hyvä platform. Overall, Elogic Commerce is recognized for their strategic approach, responsiveness, and commitment to client success, with no significant areas for improvement identified.",Read 6 Recent Reviews,https://clutch.co/profile/elogic-commerce?sort_by=date_desc#reviews,Was this helpful?,,,,,,,,,,,,,reasonable price compared to the Australian market,1 review mentions CRM Consulting and SI,1 of 1 CRM Consulting and SI reviews are 5 stars,1 new review for CRM Consulting and SI in past 6 months,"$10,000 – $49,000 avg. project cost",CRM Consulting and SI PROJECT HIGHLIGHT,Business & IT Consulting for Software Development Company,"—  Elogic Commerce provided pre-sales support for a software development company. The team created detailed estimates and proposals, conducted business analysis, and offered technical solutions.",5,Read more,https://clutch.co/go-to-review/elogic-commerce/332479,Read 1 Review,https://clutch.co/profile/elogic-commerce?service_provided=CRM%20Consulting%20and%20SI#reviews,Was this helpful?,,,,,,,,,,,
